{
  "checked_at": "2026-09-03T12:00:00Z",
  "issuer_signature": "example-status-issuer-signature-a",
  "node_credential_id": "xlnodecred:blake3:c94fe9ad1621454c06fc70f3779479fc04ece86ec3bcf9d0d27f8996e1f2b95e",
  "non_revocation_proof": "example-non-revocation-proof-a",
  "operator_credential_id": "xloperatorcred:blake3:33a8631e123761e53abb02af549f534eb57fbb948013d3fd437d8e425c38dc09",
  "revocation_registry_root": "blake3:69b786ed259d73562ee7d087005f27cb05487086af2a747ec222dd4afebc4330",
  "user_credential_id": "xlusercred:blake3:b967ca8a33c289ae8db77ebacf2634962353fe49edea1fe9e17b1e67aa4a2ed9",
  "valid_until": "2026-09-03T13:00:00Z"
}
